{
  "gameId" : "mynew wonderful game",
  "mainCharacterId" : "big pig",
  "components" : [ {
    "id" : "grinch",
    "spriteUrl" : "data/assets/grinch_15.png",
    "mass" : 1.0,
    "buttons" : [ {
      "name" : "right",
      "direction" : {
        "x" : 1.0,
        "y" : 0.0
      }
    } ]
  }, {
    "id" : "big pig",
    "spriteUrl" : "data/assets/bp_bigPig.png",
    "mass" : 100.0,
    "buttons" : [ {
      "name" : "up",
      "direction" : {
        "x" : 0.0,
        "y" : 1.0
      }
    } ]
  }, {
    "id" : "fan",
    "spriteUrl" : "data/assets/bp_fan.png",
    "mass" : 100.0,
    "buttons" : [ {
      "name" : "right",
      "direction" : {
        "x" : 10.0,
        "y" : 0.0
      }
    } ]
  } ],
  "staticComponents" : [ {
    "id" : "star",
    "spriteUrl" : "data/assets/star.png",
    "mass" : 10.0,
    "onCollisionAction" : {
      "type" : "heal",
      "amount" : 25.0
    }
  }, {
    "id" : "shield",
    "spriteUrl" : "data/assets/eyes.png",
    "mass" : 10.0,
    "onCollisionAction" : {
      "type" : "damage",
      "amount" : 25.0
    }
  }, {
    "id" : "fiinish",
    "spriteUrl" : "data/assets/duke_wordmark_navyblue_012169.png",
    "mass" : 0.0,
    "onCollisionAction" : {
      "type" : "finish",
      "amount" : 0.0
    }
  } ],
  "terrainTypes" : [ {
    "id" : "ice",
    "spriteUrl" : null,
    "visualColor" : "#ccffff",
    "friction" : 0.1
  }, {
    "id" : "grass",
    "spriteUrl" : null,
    "visualColor" : "#ccffcc",
    "friction" : 0.5
  }, {
    "id" : "mountain",
    "spriteUrl" : "data/assets/background2.png",
    "visualColor" : null,
    "friction" : 0.9
  } ]
}