{
  "gameId" : "asfd",
  "mainCharacterId" : "asdfasdf",
  "components" : [ {
    "id" : "asdfasdf",
    "spriteUrl" : "data/assets/bp_bigPig.png",
    "mass" : 100.0,
    "buttons" : [ {
      "name" : "right",
      "direction" : {
        "x" : 1.0,
        "y" : 0.0
      }
    } ]
  } ],
  "staticComponents" : [ {
    "id" : "GoalLine",
    "spriteUrl" : "data/assets/Screenshot 2026-04-21 at 11.18.40 AM.png",
    "mass" : 0.0,
    "onCollisionAction" : {
      "type" : "finish",
      "amount" : 0.0
    }
  } ],
  "terrainTypes" : [ ]
}